{
  "schema_id": "gie-1.2",
  "schema_version": "gie-1.2",
  "contract_version": "1.2.0",
  "layer": "L1",
  "scope": "internal",
  "subject_refs": ["subj_logi_001"],
  "relationship_refs": [],
  "business_data": {
    "industry": "logistics_cold_chain",
    "scenario": "knowledge_conflict",
    "conflict_resolved": false
  },
  "evidence_refs": [],
  "known_facts": {},
  "unknowns": {},
  "profile_refs": ["prof_layer_logi_001@1.0.0"],
  "scenario_refs": ["scn_knowledge_conflict_001@1.0.0"],
  "knowledge_source_refs": [],
  "credential_refs": [],
  "verification_result_refs": [],
  "authorization_refs": [],
  "gate": {
    "layer_flow": { "state": "INTERNAL_OPEN_EXTERNAL_CLOSED", "reason_code": "INTERNAL_OPEN_EXTERNAL_CLOSED" },
    "qualification": { "state": "INTERNAL_OPEN_EXTERNAL_CLOSED", "reason_code": "INTERNAL_OPEN_EXTERNAL_CLOSED" },
    "authorization": { "state": "CLOSED", "reason_code": "EXTERNAL_CLOSED_BY_DEFAULT" },
    "mutual_auth": { "state": "CLOSED", "reason_code": "EXTERNAL_CLOSED_BY_DEFAULT" },
    "effective_state": "INTERNAL_ONLY"
  },
  "l4_mode": "DISABLED",
  "l4_refs": {},
  "context_metadata": { "combo": "logistics x knowledge_conflict" },
  "audit_metadata": { "operator": "workbuddy" }
}
